{
  "schema": "new-project.intent/v3",
  "ticket": "ticket-091",
  "summary": "Add configurable post-run verification deadline",
  "workstream": "application",
  "classification": {
    "kind": "BUG",
    "priority": "P1",
    "origin": "regression"
  },
  "allowedPaths": [
    "src/koru/autonomy/post_run_verify.py",
    "src/koru/loop.py",
    "tests/test_post_run_verify_boundaries.py",
    "project/ticket-091/**"
  ],
  "forbiddenPaths": [
    "project/ticket-*/user-*.md"
  ],
  "stacks": [
    "python",
    "docker"
  ],
  "dependsOn": [
    "ticket-090"
  ],
  "conflictsWith": [],
  "integrationTicket": null,
  "delivery": {
    "acceptedBaseSha": "041e37730feb9c5227f520d23f568bea5a19a5f1",
    "targetBranch": "main",
    "outcome": "Bound native post-run verification to a finite configurable deadline, retain sanitized environment and injected runner compatibility, and publish through protected validation and merge.",
    "nonGoals": [
      "No lifecycle persistence or IDE cache redesign",
      "No non-POSIX process-tree implementation; unsupported native hosts fail explicitly"
    ],
    "complexity": "S",
    "estimatedMinutes": 45,
    "budgets": {
      "maxImplementationFiles": 3,
      "maxAffectedComponents": 2,
      "maxPublicInterfaceChanges": 1,
      "maxRuntimeDependencies": 0
    },
    "architecture": {
      "status": "accepted",
      "decision": "Add PostRunVerifyConfig.timeout_seconds defaulting to 300. Reuse the POSIX bounded loop executor through a private sanitized adapter. Preserve run_verify_commands and custom two-argument runner signatures; injected runners own their execution bounds. Invalid deadlines produce not_run; timeout returns failure 124 and stops later commands.",
      "components": [
        {
          "name": "post-run-verification",
          "paths": [
            "src/koru/autonomy/post_run_verify.py",
            "tests/test_post_run_verify_boundaries.py"
          ]
        },
        {
          "name": "bounded-command-runner",
          "paths": [
            "src/koru/loop.py"
          ]
        }
      ],
      "responsibilityChanges": false,
      "interfaceChanges": [
        "PostRunVerifyConfig and its YAML block accept timeout_seconds"
      ],
      "dataChanges": [],
      "ui": {
        "impact": "none",
        "states": [],
        "evidence": []
      },
      "rollback": "Revert this runtime and regression-test change together."
    },
    "runtimeDependencies": [],
    "validation": [
      {
        "criterion": "AC-03",
        "commands": [
          "python -m pytest -q tests/test_post_run_verify_boundaries.py tests/test_post_run_verify.py tests/test_post_run_verify_env.py tests/test_loop.py",
          "./project/governance-check.sh",
          "docker compose config --quiet"
        ],
        "evidence": "Real bounded subprocess, invalid config, fail-fast ordering, stock/custom runner and environment regressions"
      }
    ]
  }
}
