{
  "schema": "new-project.intent/v3",
  "ticket": "ticket-257",
  "summary": "decompose dispatch_validator_merge in publication to reduce cyclomatic complexity",
  "workstream": "application",
  "classification": {
    "kind": "SERVICE",
    "priority": "P2",
    "origin": "health"
  },
  "allowedPaths": [
    "project/ticket-257/**",
    "TODO.md",
    "project/TICKETS.md",
    "src/koru/ci/publication.py",
    "tests/test_ci_pipeline.py"
  ],
  "forbiddenPaths": [
    "project/ticket-*/user-*.md"
  ],
  "stacks": [],
  "dependsOn": [],
  "conflictsWith": [],
  "integrationTicket": null,
  "delivery": {
    "acceptedBaseSha": "12430d47e63ad7dea2d14a39aece66b15f76e8f9",
    "targetBranch": "main",
    "outcome": "Reduce cyclomatic complexity in src/koru/ci/publication.py by decomposing dispatch_validator_merge (CC=22 -> <=5) into focused single-responsibility helper functions (_resolve_pr_number, _verify_pr_mergeable, _build_validator_cmd) with zero regressions and 100% backward compatibility.",
    "nonGoals": [
      "Breaking public signature or return schema of dispatch_validator_merge",
      "Altering validator argument composition or dry-run format",
      "Altering PR mergeability wait and verification logic"
    ],
    "complexity": "S",
    "estimatedMinutes": 10,
    "budgets": {
      "maxImplementationFiles": 5,
      "maxAffectedComponents": 2,
      "maxPublicInterfaceChanges": 0,
      "maxRuntimeDependencies": 0
    },
    "architecture": {
      "status": "accepted",
      "decision": "Extract _resolve_pr_number, _verify_pr_mergeable, and _build_validator_cmd helper functions in publication.py.",
      "components": [
        {
          "name": "koru-ci-publication",
          "paths": [
            "src/koru/ci/publication.py",
            "tests/test_ci_pipeline.py"
          ]
        }
      ],
      "responsibilityChanges": false,
      "interfaceChanges": [],
      "dataChanges": [],
      "ui": {
        "impact": "none",
        "states": [],
        "evidence": []
      },
      "rollback": "Revert the ticket commit to restore previous publication.py implementation."
    },
    "runtimeDependencies": [],
    "validation": [
      {
        "criterion": "AC-01",
        "commands": [
          "python3 -m pytest -q -p no:wellmanifest_governance tests/test_ci_pipeline.py"
        ],
        "evidence": "All existing tests in tests/test_ci_pipeline.py pass without modification."
      },
      {
        "criterion": "AC-02",
        "commands": [
          "ruff check src/koru/ci/publication.py",
          "ruff format --check src/koru/ci/publication.py"
        ],
        "evidence": "Ruff check and format report 0 findings."
      },
      {
        "criterion": "AC-03",
        "commands": [
          "bash project/governance-check.sh"
        ],
        "evidence": "The governance gate reports 0 errors from the ticket worktree."
      }
    ]
  }
}
